Name,Avatar,Description
`Соул Итер Эванс / Soul Eater Evans`,`/char_ava/20.png`,`Мятежная душа. Настоящая фамилия, как выясняется в 35 эпизоде, — Эванс. Считает себя «крутым», и порой он действительно такой. Не самый прилежный ученик, вспыльчив и эмоционален. Добивается победы любым путём, пусть даже и не самым честным. В отличие от партнёра, у Соула нет чётко обозначенной цели — он просто хочет стать «самым крутым». Иногда совершает просто неописуемые глупости (чаще всего на пару со своим дружком — Блэк Старом). Может сражаться и в одиночку, без своего техника Маки, частично превращаясь в оружие: его правая рука становится лезвием косы. Одевается в яркую одежду (преобладают жёлтые тона).`
`Кид / Death the Kid`,`/char_ava/21.png`,`Сын Синигами, он же Синигами-младший или Смерть-младший. По сути дела, ему не нужно становиться повелителем, так как он наделён силой Синигами от рождения, но, тем не менее, Кид всё же выбрал себе в напарники сестёр Томпсон — девушек, способных превращаться в пистолеты, так как одна из его главных целей — создать идеальное по своим меркам оружие. Кид и сёстры идеально подходят друг другу как повелитель и оружие. Дыхания душ Синигами-младшего и сестёр Томпсон абсолютно совпадают, хотя это совсем разные люди: Кид — сын великого основателя Города смерти (англ. Death City), а Лиз и Патти в своём криминальном прошлом жили на улицах, занимаясь разбоем.

Резонанс душ преобразует сестёр Томпсон из пистолетов в некие устройства, похожие на смесь ракетниц с пулемётами. Что интересно, Кид — единственный повелитель, сам нашедший своё оружие за пределами Академии, а не выбравший из тех, что были свободны. Забраковав все предложенные Спиритом оружия (все были женского пола и имели два общих параметра — внушительную боевую мощь и потрясающую внешность) по параметру «несимметрично», Кид отправился на собственные поиски, которые закончились в Бруклине нападением на него шатенки высокого роста, хамоватого стиля общения, вооружённой пистолетом. Это не производило на него никакого впечатления до того момента, пока пистолет не перешёл в человеческую форму, а девушка — в форму пистолета. Сын Синигами придерживается в основном делового, «классического» стиля одежды.

Кид буквально помешан на симметрии в силу собственной асимметричности, а потому требует симметричных действий от сестёр и страшно недоволен тем, что они не близняшки (Лиз выше, зато у Патти больше грудь, Лиз шатенка — Патти блондинка, глаза Патти голубые — у Лиз они тёмно-синие) в человеческом обличье, в то время как в виде пистолетов идентичны. Нередко Синигами-младший впадает в тяжёлую депрессию, обнаружив разрушение симметрии даже по самым мелочам. Кид обладает ещё одной особенностью: он стреляет из своего оружия не как обычные люди (нажатием на спусковой крючок указательным пальцем), а в перевёрнутом стиле (нажатием на спусковой крючок мизинцем). Благодаря своему происхождению Кид владеет «боевым искусством синигами» — смертоносным единоборством. Также Смерть-младший способен призывать левитирующий магический скейтборд «Вельзевул», используемый Кидом в основном как транспорт в пути для выполнения заданий Академии.`
`Хитори Гото / Hitori Gotou`,`/char_ava/22.png`,`Застенчивая и мрачная по своей натуре школьница, которая решила начать учиться игре на гитаре после того, как увидела по телевизору выступление рок-групп. Вдохновившись, она начала мечтать, что когда-нибудь тоже станет популярной. Однако за два года обучения ей так и не удалось завести ни одного друга, который хотел бы присоединиться к группе. Отчаявшись, она заперлась дома, стала записывать гитарные каверы и выкладывать их на своём канале guitarhero, у которого появилось достаточно большое количество подписчиков.`
`Икуё Кита / Ikuyo Kita`,`/char_ava/23.png`,`Жизнерадостная старшеклассница. Солистка и гитаристка рок-группы «Кэссоку». Экстраверт до мозга костей и активно ведёт свою социальную жизнь. Присоединилась к «Кэссоку», чтобы сблизиться с Рё Ямадой, но перед первым выступлением сбежала, ведь солгала о своих навыках игры на гитаре. Однако после индивидуальных уроков Боччи научилась неплохо играть. Вернулась в группу в качестве ритм-гитариста и центрального вокалиста. Не любит своё имя, которое считает старомодным, поэтому просит звать по фамилии.`
`Нидзика Идзити / Nijika Ijichi`,`/char_ava/24.png`,`Лидер и барабанщица рок-группы «Кэссоку». Весёлая и заботливая девушка. Подрабатывает в клубе Starry, менеджером которого является её старшая сестра Сэйка. Благодаря сестре, с юных лет знакома с культурой рока. Чтобы воплотить в жизнь мечту сделать клуб популярным, пригласила свою лучшую подругу Рё для создания рок-группы.`
`Рё Ямада / Ryou Yamada`,`/char_ava/25.png`,`Бас-гитаристка рок-группы «Кэссоку». Не любит говорить о себе и не разбрасывается эмоциями. Часто делает возмутительные замечания, радуясь, когда её называют чудачкой. Ушла из прошлой группы из-за того, что они были нацелены на продажи, а не индивидуальность. После этого её лучшая подруга Нидзика Идзити пригласила её для создания своей рок-группы.
Несмотря на то, что родилась в богатой семье, всегда испытывает нужду в финансах, так как тратит много денег на музыкальные инструменты.`
`Сёко Нисимия / Shouko Nishimiya`,`/char_ava/26.png`,`Переведённая в школу Сёи Исиды глухая девушка с удивительно позитивным взглядом на жизнь. Несмотря на постоянные издевательства и нападки со стороны одноклассников, всегда старается держать улыбку на лице.

Легко забывает причинённые ей обиды, так как считает себя недостойной называться личностью. Заботится об окружающих и вместо того, чтобы обвинять настроенных против неё людей, обвиняет во всём себя. Усердно пытается помириться со своими обидчиками, несмотря на боль и унижения, которым подвергается снова и снова. В основном ходит только в школьной форме.

Легка на подъём и часто улыбается при общении с близкими, чтобы они не беспокоились о её состоянии. Очень дорожит теми людьми, которые общаются с ней, несмотря на её практически полную глухоту. Однако считает себя «бременем», так как продолжает портить их жизнь. Разделяет с Сёей одно прозвище — Сё-тян.`
`Сёя Исида / Shouya Ishida`,`/char_ava/27.png`,`Молодой человек, который издевался над Сёко Нисимией в начальной школе, и, когда она ушла из школы, бывшие друзья стали избегать его и издеваться над самим Сёей. В ответ он стал игнорировать своё окружение (представляя их крестом на лице), но всё же был доведён до желания самоубийства. Он изменил свою точку зрения, извинился перед Сёко и стал проводить с ней время. Для этого Сёя даже изучил язык жестов и оказался весьма талантливым в этом. Считает, что недостаточно наказан за издевательства в начальной школе, и часто мечтает об убийстве «того юнца». Он также, похоже, смирился с тем, что никогда не будет иметь друзей.`
`Химари Кино / Himari Kino`,`/char_ava/28.png`,null
`Ёри Асанаги / Yori Asanagi`,`/char_ava/29.png`,null
`Тосио Одзаки / Toshio Ozaki`,`/char_ava/30.png`,`Ныне директор больницы в Сотобе, раньше Тосио Одзаки работал в университетском госпитале, но вернулся в деревню, чтобы занять место своего отца, когда тот умер. Среди коллег и жителей деревни он известен под ласковым прозвищем Вака-сенсей (буквально: «молодой доктор»). У Тосио достаточно натянутые отношения с матерью, так как его родители всегда ставили репутацию семьи Одзаки превыше всего. С детства дружит с Сэйсином Муроем и Микиясу Ясимори. Ему 32 года, женат на Кёко, очень много курит. Тосио озадачен чередой таинственных смертей. Он клянётся разобраться в этом деле и защитить деревню.`
`Савако Куронума / Sawako Kuronuma`,`/char_ava/31.png`,`Скромная и молчаливая девушка. Настолько привыкла к своему прозвищу «Садако», что уже не обращает на него никакого внимания (а многие школьники, включая некоторых её одноклассников, уверены, что её и впрямь так зовут). Часто соглашается выполнять внеклассную работу для школы (от которой школьники обычно отлынивают), как она сама утверждает — чтобы чувствовать себя полезной.

Никогда не имевшая друзей, Куронума с трудом приходит к осознанию того, что в её классе есть люди — Кадзэхая, Яно, Ёсида, Санада, которым она стала небезразлична. После знакомства с Кадзэхаей начинает постепенно преодолевать всеобщее отчуждение — общаться с другими людьми, принимать участие в жизни класса — например, во время школьного спортивного фестиваля играла за женскую футбольную команду (из-за этого по школе пополз дикий слух, что Садако обладает способностями к телепортации — она настолько быстро передвигалась по полю, что никто не мог за ней уследить).

Вместе с тем, обладая почти нулевым опытом отношений, Савако часто сомневается в том, кем для неё являются те или иные люди. Доброе отношение Кадзэхаи она принимает за жалость, дружеское отношение Яно и Ёсиды — за обычную доброжелательность. Потребовался серьёзный конфликт, устроенный злокозненной Курумидзавой, чтобы Куронума и её новые друзья выяснили между собой отношения.`
`Сёта Кадзэхая / Shouta Kazehaya`,`/char_ava/32.png`,`Одноклассник Савако, из тех, кого называют «школьными-идолами». Популярен среди девушек еще со времен средней школы, популярен до такой степени, что девушки заключили между собой соглашение об «Общем Кадзэхае», дабы никто из них не претендовал на особое отношение с его стороны. В средней школе занимался бейсболом, но в старшей отказался от вступления в школьную команду.`
`Аянэ Яно / Ayane Yano`,`/char_ava/33.png`,`Одноклассница Савако и одна из её лучших подруг. Из всех персонажей-школьников выглядит наиболее взрослой — её уши проколоты пирсингом, а её парень — студент колледжа. Изначально Яно и её закадычная подруга Ёсида были задуманы мангакой как парный персонаж, в первых главах они практически ничем не отличаются друг от друга. В последующем её внешний облик был слегка изменён, и персонаж Яно стал обретать черты индивидуальности. Проницательна и умна, именно ей удалось установить источник распространившихся по школе слухов, порочащих её, Куронуму и Ёсиду. Одна из первых догадалась об истинных чувствах Савако и Сёты и многое сделала, чтобы помочь им.`
`Миёши / Miyoshi`,`/char_ava/34.png`,`Один из шпионов «Агентства Д». Рост — 170 см. Миёши предстает перед другими, как правило, надменным и самовлюбленным человеком, привыкшим смотреть на людей сверху вниз. Такие черты характера он дополняет постоянными язвительным тоном в речи и странной манерой в жестах. С первой встречи у него не заладились отношения с Сакумой, из-за строгих патриотических взглядов и военного нрава последнего. Тем не менее, позже (в частности после случае в доме Гордона) меняет свое мнение о бывшем солдате, начиная уважать Сакуму. Несмотря на все неприятные особенности характера Миёши, он — мужественный и честный человек. Так же, как и Каминага, вызывался быть шпионом добровольно и работает по большей части за границей.`
`Амари / Amari`,`/char_ava/35.png`,`Один из самых старших членов «Агентства Д», наряду с Каминагой. Рост — 175 см. Очень коммуникабельный и неравнодушный, Амари играет роль некого «старшего брата» для остальных членов агентства. Проявляет себя свободомыслящим и не цепляющимся к мелким деталям человеком. Также, он хорош в общении с противоположным полом.`
`Тазаки / Tazaki`,`/char_ava/36.png`,`Один из шпионов «Агентства Д». Рост — 173 см. Тазаки преподносит себя как вежливого и утончённого молодого человека, всегда говорит расслабленно. Таким образом многие думают, что он старше, чем есть на самом деле. Имеет привычку жонглировать предметами, оказывающимися в его руках, когда думает.`
`Докджа Ким / Dokja Kim`,`/char_ava/37.png`,`Единственный, кто дочитал новеллу «Три способа выжить в разрушенном мире» до эпилога. Выпускник третьесортного сеульского университета. Работает по контракту, а единственное его хобби — чтение веб-новелл по пути от работы до дома. В результате мутации мира приобретает уникальный атрибут, позволяющий просматривать, запоминать и выискивать нужную информацию за считанные секунды. Получил полную копию новеллы «Три способа выжить в разрушенном мире» от автора в качестве подарка.`
`Джунхёк Ю / Joonghyuk Yoo`,`/char_ava/38.png`,`Главный герой романа «Три способа выжить в разрушенном мире».`